17:22:35.008440 00:00:0a:00:00:0a > 00:00:0a:00:00:02, ethertype IPv4 (0x0800), length 66: 10.0.0.10.45616 > 10.0.0.2.80: Flags [.], ack 18999, win 130, options [nop,nop,TS val 762695 ecr 762672], length 0
17:22:35.008518 00:00:0a:00:00:09 > 00:00:0a:00:00:01, ethertype IPv4 (0x0800), length 9514: 10.0.0.9.37798 > 10.0.0.1.5201: Flags [P.], seq 897598:907046, ack 1, win 56, options [nop,nop,TS val 762666 ecr 762646], length 9448
17:22:35.026091 00:00:0a:00:00:01 > 00:00:0a:00:00:09, ethertype IPv4 (0x0800), length 66: 10.0.0.1.5201 > 10.0.0.9.37798: Flags [.], ack 888150, win 1022, options [nop,nop,TS val 762758 ecr 762627], length 0
17:22:35.028713 00:00:0a:00:00:02 > 00:00:0a:00:00:0a, ethertype IPv4 (0x0800), length 9514: 10.0.0.2.80 > 10.0.0.10.45614: Flags [P.], seq 47357:56805, ack 314, win 58, options [nop,nop,TS val 762723 ecr 762639], length 9448: HTTP
17:22:35.089677 00:00:0a:00:00:0a > 00:00:0a:00:00:02, ethertype IPv4 (0x0800), length 66: 10.0.0.10.45616 > 10.0.0.2.80: Flags [F.], seq 351, ack 24710, win 167, options [nop,nop,TS val 762714 ecr 762672], length 0
17:22:35.089724 00:00:0a:00:00:09 > 00:00:0a:00:00:01, ethertype IPv4 (0x0800), length 9514: 10.0.0.9.37798 > 10.0.0.1.5201: Flags [.], seq 907046:916494, ack 1, win 56, options [nop,nop,TS val 762684 ecr 762664], length 9448
17:22:35.105329 00:00:0a:00:00:01 > 00:00:0a:00:00:09, ethertype IPv4 (0x0800), length 66: 10.0.0.1.5201 > 10.0.0.9.37798: Flags [.], ack 897598, win 1022, options [nop,nop,TS val 762778 ecr 762647], length 0
17:22:35.105785 00:00:0a:00:00:02 > 00:00:0a:00:00:0a, ethertype IPv4 (0x0800), length 9514: 10.0.0.2.80 > 10.0.0.10.45614: Flags [.], seq 56805:66253, ack 314, win 58, options [nop,nop,TS val 762741 ecr 762657], length 9448: HTTP
17:22:35.161145 00:00:0a:00:00:0a > 00:00:0a:00:00:02, ethertype IPv4 (0x0800), length 66: 10.0.0.10.45614 > 10.0.0.2.80: Flags [.], ack 37909, win 204, options [nop,nop,TS val 762726 ecr 762695], length 0
17:22:35.161741 00:00:0a:00:00:09 > 00:00:0a:00:00:01, ethertype IPv4 (0x0800), length 9514: 10.0.0.9.37798 > 10.0.0.1.5201: Flags [.], seq 916494:925942, ack 1, win 56, options [nop,nop,TS val 762703 ecr 762682], length 9448
17:22:35.179275 00:00:0a:00:00:01 > 00:00:0a:00:00:09, ethertype IPv4 (0x0800), length 66: 10.0.0.1.5201 > 10.0.0.9.37798: Flags [.], ack 907046, win 1022, options [nop,nop,TS val 762796 ecr 762666], length 0
17:22:35.183837 00:00:0a:00:00:02 > 00:00:0a:00:00:0a, ethertype IPv4 (0x0800), length 9514: 10.0.0.2.80 > 10.0.0.10.45614: Flags [P.], seq 66253:75701, ack 314, win 58, options [nop,nop,TS val 762760 ecr 762657], length 9448: HTTP
17:22:35.237724 00:00:0a:00:00:0a > 00:00:0a:00:00:02, ethertype IPv4 (0x0800), length 66: 10.0.0.10.45614 > 10.0.0.2.80: Flags [.], ack 47357, win 224, options [nop,nop,TS val 762746 ecr 762695], length 0
17:22:35.238496 00:00:0a:00:00:09 > 00:00:0a:00:00:01, ethertype IPv4 (0x0800), length 9514: 10.0.0.9.37798 > 10.0.0.1.5201: Flags [.], seq 925942:935390, ack 1, win 56, options [nop,nop,TS val 762723 ecr 762701], length 9448
17:22:35.257410 00:00:0a:00:00:01 > 00:00:0a:00:00:09, ethertype IPv4 (0x0800), length 66: 10.0.0.1.5201 > 10.0.0.9.37798: Flags [.], ack 916494, win 1022, options [nop,nop,TS val 762815 ecr 762684], length 0
17:22:35.257457 00:00:0a:00:00:02 > 00:00:0a:00:00:0a, ethertype IPv4 (0x0800), length 9514: 10.0.0.2.80 > 10.0.0.10.45614: Flags [.], seq 75701:85149, ack 314, win 58, options [nop,nop,TS val 762779 ecr 762657], length 9448: HTTP
17:22:35.314682 00:00:0a:00:00:0a > 00:00:0a:00:00:02, ethertype IPv4 (0x0800), length 66: 10.0.0.10.45614 > 10.0.0.2.80: Flags [.], ack 56805, win 224, options [nop,nop,TS val 762764 ecr 762723], length 0
17:22:35.315260 00:00:0a:00:00:09 > 00:00:0a:00:00:01, ethertype IPv4 (0x0800), length 9514: 10.0.0.9.37798 > 10.0.0.1.5201: Flags [.], seq 935390:944838, ack 1, win 56, options [nop,nop,TS val 762741 ecr 762720], length 9448
17:22:35.333046 00:00:0a:00:00:01 > 00:00:0a:00:00:09, ethertype IPv4 (0x0800), length 66: 10.0.0.1.5201 > 10.0.0.9.37798: Flags [.], ack 925942, win 1022, options [nop,nop,TS val 762834 ecr 762703], length 0
17:22:35.333070 00:00:0a:00:00:02 > 00:00:0a:00:00:0a, ethertype IPv4 (0x0800), length 66: 10.0.0.2.80 > 10.0.0.10.45616: Flags [.], ack 352, win 58, options [nop,nop,TS val 762792 ecr 762714], length 0
17:22:35.335478 00:00:0a:00:00:02 > 00:00:0a:00:00:0a, ethertype IPv4 (0x0800), length 9514: 10.0.0.2.80 > 10.0.0.10.45614: Flags [P.], seq 85149:94597, ack 314, win 58, options [nop,nop,TS val 762798 ecr 762657], length 9448: HTTP
17:22:35.391217 00:00:0a:00:00:0a > 00:00:0a:00:00:02, ethertype IPv4 (0x0800), length 66: 10.0.0.10.45614 > 10.0.0.2.80: Flags [.], ack 66253, win 224, options [nop,nop,TS val 762783 ecr 762741], length 0
17:22:35.391956 00:00:0a:00:00:09 > 00:00:0a:00:00:01, ethertype IPv4 (0x0800), length 9514: 10.0.0.9.37798 > 10.0.0.1.5201: Flags [.], seq 944838:954286, ack 1, win 56, options [nop,nop,TS val 762760 ecr 762739], length 9448
17:22:35.415434 00:00:0a:00:00:01 > 00:00:0a:00:00:09, ethertype IPv4 (0x0800), length 66: 10.0.0.1.5201 > 10.0.0.9.37798: Flags [.], ack 935390, win 1022, options [nop,nop,TS val 762853 ecr 762723], length 0
17:22:35.420128 00:00:0a:00:00:02 > 00:00:0a:00:00:0a, ethertype IPv4 (0x0800), length 9514: 10.0.0.2.80 > 10.0.0.10.45614: Flags [.], seq 94597:104045, ack 314, win 58, options [nop,nop,TS val 762817 ecr 762726], length 9448: HTTP
17:22:35.467742 00:00:0a:00:00:0a > 00:00:0a:00:00:02, ethertype IPv4 (0x0800), length 66: 10.0.0.10.45614 > 10.0.0.2.80: Flags [.], ack 75701, win 224, options [nop,nop,TS val 762802 ecr 762760], length 0
17:22:35.468169 00:00:0a:00:00:09 > 00:00:0a:00:00:01, ethertype IPv4 (0x0800), length 9514: 10.0.0.9.37798 > 10.0.0.1.5201: Flags [.], seq 954286:963734, ack 1, win 56, options [nop,nop,TS val 762779 ecr 762758], length 9448
17:22:35.487470 00:00:0a:00:00:01 > 00:00:0a:00:00:09, ethertype IPv4 (0x0800), length 66: 10.0.0.1.5201 > 10.0.0.9.37798: Flags [.], ack 944838, win 1022, options [nop,nop,TS val 762872 ecr 762741], length 0
17:22:35.490080 00:00:0a:00:00:02 > 00:00:0a:00:00:0a, ethertype IPv4 (0x0800), length 9514: 10.0.0.2.80 > 10.0.0.10.45614: Flags [P.], seq 104045:113493, ack 314, win 58, options [nop,nop,TS val 762836 ecr 762746], length 9448: HTTP
17:22:35.544756 00:00:0a:00:00:0a > 00:00:0a:00:00:02, ethertype IPv4 (0x0800), length 66: 10.0.0.10.45614 > 10.0.0.2.80: Flags [.], ack 85149, win 224, options [nop,nop,TS val 762822 ecr 762779], length 0
17:22:35.544866 00:00:0a:00:00:09 > 00:00:0a:00:00:01, ethertype IPv4 (0x0800), length 9514: 10.0.0.9.37798 > 10.0.0.1.5201: Flags [.], seq 963734:973182, ack 1, win 56, options [nop,nop,TS val 762798 ecr 762778], length 9448
17:22:35.564556 00:00:0a:00:00:01 > 00:00:0a:00:00:09, ethertype IPv4 (0x0800), length 66: 10.0.0.1.5201 > 10.0.0.9.37798: Flags [.], ack 954286, win 1022, options [nop,nop,TS val 762891 ecr 762760], length 0
17:22:35.564796 00:00:0a:00:00:02 > 00:00:0a:00:00:0a, ethertype IPv4 (0x0800), length 9514: 10.0.0.2.80 > 10.0.0.10.45614: Flags [.], seq 113493:122941, ack 314, win 58, options [nop,nop,TS val 762856 ecr 762764], length 9448: HTTP
17:22:35.622047 00:00:0a:00:00:0a > 00:00:0a:00:00:02, ethertype IPv4 (0x0800), length 66: 10.0.0.10.45614 > 10.0.0.2.80: Flags [.], ack 94597, win 224, options [nop,nop,TS val 762841 ecr 762798], length 0
17:22:35.622097 00:00:0a:00:00:09 > 00:00:0a:00:00:01, ethertype IPv4 (0x0800), length 9514: 10.0.0.9.37798 > 10.0.0.1.5201: Flags [.], seq 973182:982630, ack 1, win 56, options [nop,nop,TS val 762817 ecr 762796], length 9448
17:22:35.639733 00:00:0a:00:00:01 > 00:00:0a:00:00:09, ethertype IPv4 (0x0800), length 66: 10.0.0.1.5201 > 10.0.0.9.37798: Flags [.], ack 963734, win 1022, options [nop,nop,TS val 762910 ecr 762779], length 0
17:22:35.648777 00:00:0a:00:00:02 > 00:00:0a:00:00:0a, ethertype IPv4 (0x0800), length 9514: 10.0.0.2.80 > 10.0.0.10.45614: Flags [.], seq 122941:132389, ack 314, win 58, options [nop,nop,TS val 762874 ecr 762783], length 9448: HTTP
17:22:35.699467 00:00:0a:00:00:0a > 00:00:0a:00:00:02, ethertype IPv4 (0x0800), length 66: 10.0.0.10.45614 > 10.0.0.2.80: Flags [.], ack 104045, win 224, options [nop,nop,TS val 762861 ecr 762817], length 0
17:22:35.699482 00:00:0a:00:00:09 > 00:00:0a:00:00:01, ethertype IPv4 (0x0800), length 9514: 10.0.0.9.37798 > 10.0.0.1.5201: Flags [.], seq 982630:992078, ack 1, win 56, options [nop,nop,TS val 762836 ecr 762815], length 9448
17:22:35.716574 00:00:0a:00:00:01 > 00:00:0a:00:00:09, ethertype IPv4 (0x0800), length 66: 10.0.0.1.5201 > 10.0.0.9.37798: Flags [.], ack 973182, win 1022, options [nop,nop,TS val 762929 ecr 762798], length 0
17:22:35.716775 00:00:0a:00:00:02 > 00:00:0a:00:00:0a, ethertype IPv4 (0x0800), length 9514: 10.0.0.2.80 > 10.0.0.10.45614: Flags [.], seq 132389:141837, ack 314, win 58, options [nop,nop,TS val 762893 ecr 762802], length 9448: HTTP
17:22:35.776638 00:00:0a:00:00:0a > 00:00:0a:00:00:02, ethertype IPv4 (0x0800), length 66: 10.0.0.10.45614 > 10.0.0.2.80: Flags [.], ack 113493, win 261, options [nop,nop,TS val 762879 ecr 762836], length 0
17:22:35.776657 00:00:0a:00:00:09 > 00:00:0a:00:00:01, ethertype IPv4 (0x0800), length 9514: 10.0.0.9.37798 > 10.0.0.1.5201: Flags [P.], seq 992078:1001526, ack 1, win 56, options [nop,nop,TS val 762856 ecr 762834], length 9448
17:22:35.792919 00:00:0a:00:00:01 > 00:00:0a:00:00:09, ethertype IPv4 (0x0800), length 66: 10.0.0.1.5201 > 10.0.0.9.37798: Flags [.], ack 982630, win 1022, options [nop,nop,TS val 762948 ecr 762817], length 0
17:22:35.793407 00:00:0a:00:00:02 > 00:00:0a:00:00:0a, ethertype IPv4 (0x0800), length 9514: 10.0.0.2.80 > 10.0.0.10.45614: Flags [.], seq 141837:151285, ack 314, win 58, options [nop,nop,TS val 762913 ecr 762822], length 9448: HTTP
17:22:35.851151 00:00:0a:00:00:0a > 00:00:0a:00:00:02, ethertype IPv4 (0x0800), length 66: 10.0.0.10.45614 > 10.0.0.2.80: Flags [.], ack 122941, win 298, options [nop,nop,TS val 762898 ecr 762856], length 0
17:22:35.851518 00:00:0a:00:00:09 > 00:00:0a:00:00:01, ethertype IPv4 (0x0800), length 9514: 10.0.0.9.37798 > 10.0.0.1.5201: Flags [.], seq 1001526:1010974, ack 1, win 56, options [nop,nop,TS val 762874 ecr 762853], length 9448
17:22:35.869529 00:00:0a:00:00:01 > 00:00:0a:00:00:09, ethertype IPv4 (0x0800), length 66: 10.0.0.1.5201 > 10.0.0.9.37798: Flags [.], ack 992078, win 1022, options [nop,nop,TS val 762968 ecr 762836], length 0
17:22:35.870129 00:00:0a:00:00:02 > 00:00:0a:00:00:0a, ethertype IPv4 (0x0800), length 9514: 10.0.0.2.80 > 10.0.0.10.45614: Flags [P.], seq 151285:160733, ack 314, win 58, options [nop,nop,TS val 762932 ecr 762841], length 9448: HTTP
17:22:35.927524 00:00:0a:00:00:0a > 00:00:0a:00:00:02, ethertype IPv4 (0x0800), length 66: 10.0.0.10.45614 > 10.0.0.2.80: Flags [.], ack 132389, win 335, options [nop,nop,TS val 762918 ecr 762874], length 0
17:22:35.928366 00:00:0a:00:00:09 > 00:00:0a:00:00:01, ethertype IPv4 (0x0800), length 9514: 10.0.0.9.37798 > 10.0.0.1.5201: Flags [.], seq 1010974:1020422, ack 1, win 56, options [nop,nop,TS val 762893 ecr 762872], length 9448
17:22:35.946511 00:00:0a:00:00:01 > 00:00:0a:00:00:09, ethertype IPv4 (0x0800), length 66: 10.0.0.1.5201 > 10.0.0.9.37798: Flags [.], ack 1001526, win 1022, options [nop,nop,TS val 762986 ecr 762856], length 0
