17:22:27.358502 00:00:0a:00:00:09 > 00:00:0a:00:00:01, ethertype IPv4 (0x0800), length 74: 10.0.0.9.37796 > 10.0.0.1.5201: Flags [S], seq 637135625, win 28380, options [mss 9460,sackOK,TS val 760845 ecr 0,nop,wscale 9], length 0
17:22:27.360515 00:00:0a:00:00:01 > 00:00:0a:00:00:09, ethertype IPv4 (0x0800), length 74: 10.0.0.1.5201 > 10.0.0.9.37796: Flags [S.], seq 2884547296, ack 637135626, win 28344, options [mss 9460,sackOK,TS val 760845 ecr 760845,nop,wscale 9], length 0
17:22:27.362722 00:00:0a:00:00:09 > 00:00:0a:00:00:01, ethertype IPv4 (0x0800), length 66: 10.0.0.9.37796 > 10.0.0.1.5201: Flags [.], ack 1, win 56, options [nop,nop,TS val 760846 ecr 760845], length 0
17:22:27.363763 00:00:0a:00:00:09 > 00:00:0a:00:00:01, ethertype IPv4 (0x0800), length 103: 10.0.0.9.37796 > 10.0.0.1.5201: Flags [P.], seq 1:38, ack 1, win 56, options [nop,nop,TS val 760846 ecr 760845], length 37
17:22:27.365609 00:00:0a:00:00:01 > 00:00:0a:00:00:09, ethertype IPv4 (0x0800), length 66: 10.0.0.1.5201 > 10.0.0.9.37796: Flags [.], ack 38, win 56, options [nop,nop,TS val 760846 ecr 760846], length 0
17:22:27.365642 00:00:0a:00:00:01 > 00:00:0a:00:00:09, ethertype IPv4 (0x0800), length 67: 10.0.0.1.5201 > 10.0.0.9.37796: Flags [P.], seq 1:2, ack 38, win 56, options [nop,nop,TS val 760846 ecr 760846], length 1
17:22:27.370753 00:00:0a:00:00:09 > 00:00:0a:00:00:01, ethertype IPv4 (0x0800), length 66: 10.0.0.9.37796 > 10.0.0.1.5201: Flags [.], ack 2, win 56, options [nop,nop,TS val 760847 ecr 760846], length 0
17:22:27.371491 00:00:0a:00:00:09 > 00:00:0a:00:00:01, ethertype IPv4 (0x0800), length 70: 10.0.0.9.37796 > 10.0.0.1.5201: Flags [P.], seq 38:42, ack 2, win 56, options [nop,nop,TS val 760848 ecr 760846], length 4
17:22:27.411476 00:00:0a:00:00:01 > 00:00:0a:00:00:09, ethertype IPv4 (0x0800), length 66: 10.0.0.1.5201 > 10.0.0.9.37796: Flags [.], ack 42, win 56, options [nop,nop,TS val 760858 ecr 760848], length 0
17:22:27.415106 00:00:0a:00:00:09 > 00:00:0a:00:00:01, ethertype IPv4 (0x0800), length 149: 10.0.0.9.37796 > 10.0.0.1.5201: Flags [P.], seq 42:125, ack 2, win 56, options [nop,nop,TS val 760859 ecr 760858], length 83
17:22:27.417775 00:00:0a:00:00:01 > 00:00:0a:00:00:09, ethertype IPv4 (0x0800), length 66: 10.0.0.1.5201 > 10.0.0.9.37796: Flags [.], ack 125, win 56, options [nop,nop,TS val 760859 ecr 760859], length 0
17:22:27.418071 00:00:0a:00:00:01 > 00:00:0a:00:00:09, ethertype IPv4 (0x0800), length 67: 10.0.0.1.5201 > 10.0.0.9.37796: Flags [P.], seq 2:3, ack 125, win 56, options [nop,nop,TS val 760859 ecr 760859], length 1
17:22:27.429380 00:00:0a:00:00:09 > 00:00:0a:00:00:01, ethertype IPv4 (0x0800), length 74: 10.0.0.9.37798 > 10.0.0.1.5201: Flags [S], seq 2514186261, win 28380, options [mss 9460,sackOK,TS val 760862 ecr 0,nop,wscale 9], length 0
17:22:27.435229 00:00:0a:00:00:01 > 00:00:0a:00:00:09, ethertype IPv4 (0x0800), length 74: 10.0.0.1.5201 > 10.0.0.9.37798: Flags [S.], seq 932779382, ack 2514186262, win 28344, options [mss 9460,sackOK,TS val 760863 ecr 760862,nop,wscale 9], length 0
17:22:27.440752 00:00:0a:00:00:09 > 00:00:0a:00:00:01, ethertype IPv4 (0x0800), length 66: 10.0.0.9.37798 > 10.0.0.1.5201: Flags [.], ack 1, win 56, options [nop,nop,TS val 760865 ecr 760863], length 0
17:22:27.441746 00:00:0a:00:00:09 > 00:00:0a:00:00:01, ethertype IPv4 (0x0800), length 103: 10.0.0.9.37798 > 10.0.0.1.5201: Flags [P.], seq 1:38, ack 1, win 56, options [nop,nop,TS val 760865 ecr 760863], length 37
17:22:27.448831 00:00:0a:00:00:01 > 00:00:0a:00:00:09, ethertype IPv4 (0x0800), length 66: 10.0.0.1.5201 > 10.0.0.9.37798: Flags [.], ack 38, win 56, options [nop,nop,TS val 760866 ecr 760865], length 0
17:22:27.462404 00:00:0a:00:00:09 > 00:00:0a:00:00:01, ethertype IPv4 (0x0800), length 66: 10.0.0.9.37796 > 10.0.0.1.5201: Flags [.], ack 3, win 56, options [nop,nop,TS val 760871 ecr 760859], length 0
17:22:27.464536 00:00:0a:00:00:01 > 00:00:0a:00:00:09, ethertype IPv4 (0x0800), length 68: 10.0.0.1.5201 > 10.0.0.9.37796: Flags [P.], seq 3:5, ack 125, win 56, options [nop,nop,TS val 760871 ecr 760871], length 2
17:22:27.469330 00:00:0a:00:00:09 > 00:00:0a:00:00:01, ethertype IPv4 (0x0800), length 66: 10.0.0.9.37796 > 10.0.0.1.5201: Flags [.], ack 5, win 56, options [nop,nop,TS val 760872 ecr 760871], length 0
17:22:27.469371 00:00:0a:00:00:09 > 00:00:0a:00:00:01, ethertype IPv4 (0x0800), length 9514: 10.0.0.9.37798 > 10.0.0.1.5201: Flags [.], seq 38:9486, ack 1, win 56, options [nop,nop,TS val 760872 ecr 760866], length 9448
17:22:27.472984 00:00:0a:00:00:01 > 00:00:0a:00:00:09, ethertype IPv4 (0x0800), length 66: 10.0.0.1.5201 > 10.0.0.9.37798: Flags [.], ack 9486, win 93, options [nop,nop,TS val 760873 ecr 760872], length 0
17:22:27.533533 00:00:0a:00:00:09 > 00:00:0a:00:00:01, ethertype IPv4 (0x0800), length 9514: 10.0.0.9.37798 > 10.0.0.1.5201: Flags [P.], seq 9486:18934, ack 1, win 56, options [nop,nop,TS val 760872 ecr 760866], length 9448
17:22:27.536343 00:00:0a:00:00:01 > 00:00:0a:00:00:09, ethertype IPv4 (0x0800), length 66: 10.0.0.1.5201 > 10.0.0.9.37798: Flags [.], ack 18934, win 130, options [nop,nop,TS val 760889 ecr 760872], length 0
17:22:27.612689 00:00:0a:00:00:09 > 00:00:0a:00:00:01, ethertype IPv4 (0x0800), length 9514: 10.0.0.9.37798 > 10.0.0.1.5201: Flags [.], seq 18934:28382, ack 1, win 56, options [nop,nop,TS val 760872 ecr 760866], length 9448
17:22:27.623969 00:00:0a:00:00:01 > 00:00:0a:00:00:09, ethertype IPv4 (0x0800), length 66: 10.0.0.1.5201 > 10.0.0.9.37798: Flags [.], ack 28382, win 167, options [nop,nop,TS val 760909 ecr 760872], length 0
17:22:27.687589 00:00:0a:00:00:09 > 00:00:0a:00:00:01, ethertype IPv4 (0x0800), length 9514: 10.0.0.9.37798 > 10.0.0.1.5201: Flags [P.], seq 28382:37830, ack 1, win 56, options [nop,nop,TS val 760888 ecr 760873], length 9448
17:22:27.691313 00:00:0a:00:00:01 > 00:00:0a:00:00:09, ethertype IPv4 (0x0800), length 66: 10.0.0.1.5201 > 10.0.0.9.37798: Flags [.], ack 37830, win 203, options [nop,nop,TS val 760928 ecr 760888], length 0
17:22:27.762130 00:00:0a:00:00:09 > 00:00:0a:00:00:01, ethertype IPv4 (0x0800), length 9514: 10.0.0.9.37798 > 10.0.0.1.5201: Flags [.], seq 37830:47278, ack 1, win 56, options [nop,nop,TS val 760907 ecr 760889], length 9448
17:22:27.764120 00:00:0a:00:00:01 > 00:00:0a:00:00:09, ethertype IPv4 (0x0800), length 66: 10.0.0.1.5201 > 10.0.0.9.37798: Flags [.], ack 47278, win 224, options [nop,nop,TS val 760946 ecr 760907], length 0
17:22:27.839705 00:00:0a:00:00:09 > 00:00:0a:00:00:01, ethertype IPv4 (0x0800), length 9514: 10.0.0.9.37798 > 10.0.0.1.5201: Flags [P.], seq 47278:56726, ack 1, win 56, options [nop,nop,TS val 760926 ecr 760909], length 9448
17:22:27.842212 00:00:0a:00:00:01 > 00:00:0a:00:00:09, ethertype IPv4 (0x0800), length 66: 10.0.0.1.5201 > 10.0.0.9.37798: Flags [.], ack 56726, win 224, options [nop,nop,TS val 760966 ecr 760926], length 0
17:22:27.914529 00:00:0a:00:00:09 > 00:00:0a:00:00:01, ethertype IPv4 (0x0800), length 9514: 10.0.0.9.37798 > 10.0.0.1.5201: Flags [.], seq 56726:66174, ack 1, win 56, options [nop,nop,TS val 760945 ecr 760928], length 9448
17:22:27.917978 00:00:0a:00:00:01 > 00:00:0a:00:00:09, ethertype IPv4 (0x0800), length 66: 10.0.0.1.5201 > 10.0.0.9.37798: Flags [.], ack 66174, win 224, options [nop,nop,TS val 760984 ecr 760945], length 0
17:22:27.992165 00:00:0a:00:00:09 > 00:00:0a:00:00:01, ethertype IPv4 (0x0800), length 9514: 10.0.0.9.37798 > 10.0.0.1.5201: Flags [P.], seq 66174:75622, ack 1, win 56, options [nop,nop,TS val 760965 ecr 760946], length 9448
17:22:27.995796 00:00:0a:00:00:01 > 00:00:0a:00:00:09, ethertype IPv4 (0x0800), length 66: 10.0.0.1.5201 > 10.0.0.9.37798: Flags [.], ack 75622, win 224, options [nop,nop,TS val 761004 ecr 760965], length 0
17:22:28.067096 00:00:0a:00:00:09 > 00:00:0a:00:00:01, ethertype IPv4 (0x0800), length 9514: 10.0.0.9.37798 > 10.0.0.1.5201: Flags [.], seq 75622:85070, ack 1, win 56, options [nop,nop,TS val 760983 ecr 760966], length 9448
17:22:28.069171 00:00:0a:00:00:01 > 00:00:0a:00:00:09, ethertype IPv4 (0x0800), length 66: 10.0.0.1.5201 > 10.0.0.9.37798: Flags [.], ack 85070, win 224, options [nop,nop,TS val 761022 ecr 760983], length 0
17:22:28.142106 00:00:0a:00:00:09 > 00:00:0a:00:00:01, ethertype IPv4 (0x0800), length 9514: 10.0.0.9.37798 > 10.0.0.1.5201: Flags [P.], seq 85070:94518, ack 1, win 56, options [nop,nop,TS val 761003 ecr 760984], length 9448
17:22:28.146774 00:00:0a:00:00:01 > 00:00:0a:00:00:09, ethertype IPv4 (0x0800), length 66: 10.0.0.1.5201 > 10.0.0.9.37798: Flags [.], ack 94518, win 224, options [nop,nop,TS val 761042 ecr 761003], length 0
17:22:28.220883 00:00:0a:00:00:09 > 00:00:0a:00:00:01, ethertype IPv4 (0x0800), length 9514: 10.0.0.9.37798 > 10.0.0.1.5201: Flags [.], seq 94518:103966, ack 1, win 56, options [nop,nop,TS val 761022 ecr 761004], length 9448
17:22:28.223095 00:00:0a:00:00:01 > 00:00:0a:00:00:09, ethertype IPv4 (0x0800), length 66: 10.0.0.1.5201 > 10.0.0.9.37798: Flags [.], ack 103966, win 224, options [nop,nop,TS val 761061 ecr 761022], length 0
17:22:28.314561 00:00:0a:00:00:09 > 00:00:0a:00:00:01, ethertype IPv4 (0x0800), length 9514: 10.0.0.9.37798 > 10.0.0.1.5201: Flags [P.], seq 103966:113414, ack 1, win 56, options [nop,nop,TS val 761040 ecr 761022], length 9448
17:22:28.316958 00:00:0a:00:00:01 > 00:00:0a:00:00:09, ethertype IPv4 (0x0800), length 66: 10.0.0.1.5201 > 10.0.0.9.37798: Flags [.], ack 113414, win 224, options [nop,nop,TS val 761084 ecr 761040], length 0
17:22:28.378257 00:00:0a:00:00:09 > 00:00:0a:00:00:01, ethertype IPv4 (0x0800), length 9514: 10.0.0.9.37798 > 10.0.0.1.5201: Flags [.], seq 113414:122862, ack 1, win 56, options [nop,nop,TS val 761060 ecr 761042], length 9448
17:22:28.381315 00:00:0a:00:00:01 > 00:00:0a:00:00:09, ethertype IPv4 (0x0800), length 66: 10.0.0.1.5201 > 10.0.0.9.37798: Flags [.], ack 122862, win 224, options [nop,nop,TS val 761100 ecr 761060], length 0
17:22:28.454692 00:00:0a:00:00:09 > 00:00:0a:00:00:01, ethertype IPv4 (0x0800), length 9514: 10.0.0.9.37798 > 10.0.0.1.5201: Flags [.], seq 122862:132310, ack 1, win 56, options [nop,nop,TS val 761083 ecr 761061], length 9448
17:22:28.457332 00:00:0a:00:00:01 > 00:00:0a:00:00:09, ethertype IPv4 (0x0800), length 66: 10.0.0.1.5201 > 10.0.0.9.37798: Flags [.], ack 132310, win 224, options [nop,nop,TS val 761119 ecr 761083], length 0
17:22:28.531401 00:00:0a:00:00:09 > 00:00:0a:00:00:01, ethertype IPv4 (0x0800), length 9514: 10.0.0.9.37798 > 10.0.0.1.5201: Flags [.], seq 132310:141758, ack 1, win 56, options [nop,nop,TS val 761099 ecr 761084], length 9448
17:22:28.534692 00:00:0a:00:00:01 > 00:00:0a:00:00:09, ethertype IPv4 (0x0800), length 66: 10.0.0.1.5201 > 10.0.0.9.37798: Flags [.], ack 141758, win 224, options [nop,nop,TS val 761138 ecr 761099], length 0
17:22:28.606326 00:00:0a:00:00:09 > 00:00:0a:00:00:01, ethertype IPv4 (0x0800), length 9514: 10.0.0.9.37798 > 10.0.0.1.5201: Flags [P.], seq 141758:151206, ack 1, win 56, options [nop,nop,TS val 761119 ecr 761100], length 9448
17:22:28.609056 00:00:0a:00:00:01 > 00:00:0a:00:00:09, ethertype IPv4 (0x0800), length 66: 10.0.0.1.5201 > 10.0.0.9.37798: Flags [.], ack 151206, win 224, options [nop,nop,TS val 761157 ecr 761119], length 0
17:22:28.685479 00:00:0a:00:00:09 > 00:00:0a:00:00:01, ethertype IPv4 (0x0800), length 9514: 10.0.0.9.37798 > 10.0.0.1.5201: Flags [.], seq 151206:160654, ack 1, win 56, options [nop,nop,TS val 761138 ecr 761119], length 9448
17:22:28.687526 00:00:0a:00:00:01 > 00:00:0a:00:00:09, ethertype IPv4 (0x0800), length 66: 10.0.0.1.5201 > 10.0.0.9.37798: Flags [.], ack 160654, win 224, options [nop,nop,TS val 761177 ecr 761138], length 0
17:22:28.758695 00:00:0a:00:00:09 > 00:00:0a:00:00:01, ethertype IPv4 (0x0800), length 9514: 10.0.0.9.37798 > 10.0.0.1.5201: Flags [P.], seq 160654:170102, ack 1, win 56, options [nop,nop,TS val 761156 ecr 761138], length 9448
17:22:28.761275 00:00:0a:00:00:01 > 00:00:0a:00:00:09, ethertype IPv4 (0x0800), length 66: 10.0.0.1.5201 > 10.0.0.9.37798: Flags [.], ack 170102, win 224, options [nop,nop,TS val 761195 ecr 761156], length 0
17:22:28.834783 00:00:0a:00:00:09 > 00:00:0a:00:00:01, ethertype IPv4 (0x0800), length 9514: 10.0.0.9.37798 > 10.0.0.1.5201: Flags [.], seq 170102:179550, ack 1, win 56, options [nop,nop,TS val 761175 ecr 761157], length 9448
17:22:28.837147 00:00:0a:00:00:01 > 00:00:0a:00:00:09, ethertype IPv4 (0x0800), length 66: 10.0.0.1.5201 > 10.0.0.9.37798: Flags [.], ack 179550, win 224, options [nop,nop,TS val 761214 ecr 761175], length 0
17:22:28.913212 00:00:0a:00:00:09 > 00:00:0a:00:00:01, ethertype IPv4 (0x0800), length 9514: 10.0.0.9.37798 > 10.0.0.1.5201: Flags [P.], seq 179550:188998, ack 1, win 56, options [nop,nop,TS val 761195 ecr 761177], length 9448
17:22:28.954714 00:00:0a:00:00:01 > 00:00:0a:00:00:09, ethertype IPv4 (0x0800), length 66: 10.0.0.1.5201 > 10.0.0.9.37798: Flags [.], ack 188998, win 224, options [nop,nop,TS val 761244 ecr 761195], length 0
17:22:28.989112 00:00:0a:00:00:09 > 00:00:0a:00:00:01, ethertype IPv4 (0x0800), length 9514: 10.0.0.9.37798 > 10.0.0.1.5201: Flags [.], seq 188998:198446, ack 1, win 56, options [nop,nop,TS val 761213 ecr 761195], length 9448
17:22:29.030229 00:00:0a:00:00:01 > 00:00:0a:00:00:09, ethertype IPv4 (0x0800), length 66: 10.0.0.1.5201 > 10.0.0.9.37798: Flags [.], ack 198446, win 224, options [nop,nop,TS val 761263 ecr 761213], length 0
17:22:29.063216 00:00:0a:00:00:09 > 00:00:0a:00:00:01, ethertype IPv4 (0x0800), length 9514: 10.0.0.9.37798 > 10.0.0.1.5201: Flags [.], seq 198446:207894, ack 1, win 56, options [nop,nop,TS val 761233 ecr 761214], length 9448
17:22:29.102212 00:00:0a:00:00:01 > 00:00:0a:00:00:09, ethertype IPv4 (0x0800), length 66: 10.0.0.1.5201 > 10.0.0.9.37798: Flags [.], ack 207894, win 224, options [nop,nop,TS val 761281 ecr 761233], length 0
17:22:29.139171 00:00:0a:00:00:09 > 00:00:0a:00:00:01, ethertype IPv4 (0x0800), length 9514: 10.0.0.9.37798 > 10.0.0.1.5201: Flags [.], seq 207894:217342, ack 1, win 56, options [nop,nop,TS val 761252 ecr 761244], length 9448
17:22:29.182735 00:00:0a:00:00:01 > 00:00:0a:00:00:09, ethertype IPv4 (0x0800), length 66: 10.0.0.1.5201 > 10.0.0.9.37798: Flags [.], ack 217342, win 224, options [nop,nop,TS val 761301 ecr 761252], length 0
17:22:29.216231 00:00:0a:00:00:09 > 00:00:0a:00:00:01, ethertype IPv4 (0x0800), length 9514: 10.0.0.9.37798 > 10.0.0.1.5201: Flags [.], seq 217342:226790, ack 1, win 56, options [nop,nop,TS val 761271 ecr 761263], length 9448
17:22:29.260843 00:00:0a:00:00:01 > 00:00:0a:00:00:09, ethertype IPv4 (0x0800), length 66: 10.0.0.1.5201 > 10.0.0.9.37798: Flags [.], ack 226790, win 224, options [nop,nop,TS val 761320 ecr 761271], length 0
17:22:29.292101 00:00:0a:00:00:09 > 00:00:0a:00:00:01, ethertype IPv4 (0x0800), length 9514: 10.0.0.9.37798 > 10.0.0.1.5201: Flags [.], seq 226790:236238, ack 1, win 56, options [nop,nop,TS val 761290 ecr 761281], length 9448
17:22:29.335248 00:00:0a:00:00:01 > 00:00:0a:00:00:09, ethertype IPv4 (0x0800), length 66: 10.0.0.1.5201 > 10.0.0.9.37798: Flags [.], ack 236238, win 224, options [nop,nop,TS val 761339 ecr 761290], length 0
17:22:29.372380 00:00:0a:00:00:09 > 00:00:0a:00:00:01, ethertype IPv4 (0x0800), length 9514: 10.0.0.9.37798 > 10.0.0.1.5201: Flags [.], seq 236238:245686, ack 1, win 56, options [nop,nop,TS val 761309 ecr 761301], length 9448
17:22:29.414416 00:00:0a:00:00:01 > 00:00:0a:00:00:09, ethertype IPv4 (0x0800), length 66: 10.0.0.1.5201 > 10.0.0.9.37798: Flags [.], ack 245686, win 224, options [nop,nop,TS val 761359 ecr 761309], length 0
17:22:29.449460 00:00:0a:00:00:09 > 00:00:0a:00:00:01, ethertype IPv4 (0x0800), length 9514: 10.0.0.9.37798 > 10.0.0.1.5201: Flags [P.], seq 245686:255134, ack 1, win 56, options [nop,nop,TS val 761328 ecr 761320], length 9448
17:22:29.490053 00:00:0a:00:00:01 > 00:00:0a:00:00:09, ethertype IPv4 (0x0800), length 66: 10.0.0.1.5201 > 10.0.0.9.37798: Flags [.], ack 255134, win 224, options [nop,nop,TS val 761378 ecr 761328], length 0
17:22:29.519749 00:00:0a:00:00:09 > 00:00:0a:00:00:01, ethertype IPv4 (0x0800), length 9514: 10.0.0.9.37798 > 10.0.0.1.5201: Flags [.], seq 255134:264582, ack 1, win 56, options [nop,nop,TS val 761348 ecr 761339], length 9448
17:22:29.564646 00:00:0a:00:00:01 > 00:00:0a:00:00:09, ethertype IPv4 (0x0800), length 66: 10.0.0.1.5201 > 10.0.0.9.37798: Flags [.], ack 264582, win 224, options [nop,nop,TS val 761396 ecr 761348], length 0
17:22:29.595761 00:00:0a:00:00:09 > 00:00:0a:00:00:01, ethertype IPv4 (0x0800), length 9514: 10.0.0.9.37798 > 10.0.0.1.5201: Flags [.], seq 264582:274030, ack 1, win 56, options [nop,nop,TS val 761367 ecr 761359], length 9448
17:22:29.637713 00:00:0a:00:00:01 > 00:00:0a:00:00:09, ethertype IPv4 (0x0800), length 66: 10.0.0.1.5201 > 10.0.0.9.37798: Flags [.], ack 274030, win 224, options [nop,nop,TS val 761415 ecr 761367], length 0
17:22:29.671779 00:00:0a:00:00:09 > 00:00:0a:00:00:01, ethertype IPv4 (0x0800), length 9514: 10.0.0.9.37798 > 10.0.0.1.5201: Flags [.], seq 274030:283478, ack 1, win 56, options [nop,nop,TS val 761385 ecr 761378], length 9448
17:22:29.715331 00:00:0a:00:00:01 > 00:00:0a:00:00:09, ethertype IPv4 (0x0800), length 66: 10.0.0.1.5201 > 10.0.0.9.37798: Flags [.], ack 283478, win 224, options [nop,nop,TS val 761434 ecr 761385], length 0
17:22:29.749472 00:00:0a:00:00:09 > 00:00:0a:00:00:01, ethertype IPv4 (0x0800), length 9514: 10.0.0.9.37798 > 10.0.0.1.5201: Flags [.], seq 283478:292926, ack 1, win 56, options [nop,nop,TS val 761404 ecr 761396], length 9448
17:22:29.789698 00:00:0a:00:00:01 > 00:00:0a:00:00:09, ethertype IPv4 (0x0800), length 66: 10.0.0.1.5201 > 10.0.0.9.37798: Flags [.], ack 292926, win 224, options [nop,nop,TS val 761453 ecr 761404], length 0
17:22:29.825704 00:00:0a:00:00:09 > 00:00:0a:00:00:01, ethertype IPv4 (0x0800), length 9514: 10.0.0.9.37798 > 10.0.0.1.5201: Flags [.], seq 292926:302374, ack 1, win 56, options [nop,nop,TS val 761423 ecr 761415], length 9448
17:22:29.866042 00:00:0a:00:00:01 > 00:00:0a:00:00:09, ethertype IPv4 (0x0800), length 66: 10.0.0.1.5201 > 10.0.0.9.37798: Flags [.], ack 302374, win 224, options [nop,nop,TS val 761472 ecr 761423], length 0
17:22:29.900445 00:00:0a:00:00:09 > 00:00:0a:00:00:01, ethertype IPv4 (0x0800), length 9514: 10.0.0.9.37798 > 10.0.0.1.5201: Flags [.], seq 302374:311822, ack 1, win 56, options [nop,nop,TS val 761442 ecr 761434], length 9448
17:22:29.941778 00:00:0a:00:00:01 > 00:00:0a:00:00:09, ethertype IPv4 (0x0800), length 66: 10.0.0.1.5201 > 10.0.0.9.37798: Flags [.], ack 311822, win 224, options [nop,nop,TS val 761491 ecr 761442], length 0
17:22:29.976623 00:00:0a:00:00:09 > 00:00:0a:00:00:01, ethertype IPv4 (0x0800), length 9514: 10.0.0.9.37798 > 10.0.0.1.5201: Flags [P.], seq 311822:321270, ack 1, win 56, options [nop,nop,TS val 761461 ecr 761453], length 9448
17:22:30.018563 00:00:0a:00:00:01 > 00:00:0a:00:00:09, ethertype IPv4 (0x0800), length 66: 10.0.0.1.5201 > 10.0.0.9.37798: Flags [.], ack 321270, win 224, options [nop,nop,TS val 761510 ecr 761461], length 0
17:22:30.052670 00:00:0a:00:00:09 > 00:00:0a:00:00:01, ethertype IPv4 (0x0800), length 9514: 10.0.0.9.37798 > 10.0.0.1.5201: Flags [.], seq 321270:330718, ack 1, win 56, options [nop,nop,TS val 761480 ecr 761472], length 9448
17:22:30.094009 00:00:0a:00:00:01 > 00:00:0a:00:00:09, ethertype IPv4 (0x0800), length 66: 10.0.0.1.5201 > 10.0.0.9.37798: Flags [.], ack 330718, win 224, options [nop,nop,TS val 761529 ecr 761480], length 0
17:22:30.138137 00:00:0a:00:00:09 > 00:00:0a:00:00:01, ethertype IPv4 (0x0800), length 9514: 10.0.0.9.37798 > 10.0.0.1.5201: Flags [.], seq 330718:340166, ack 1, win 56, options [nop,nop,TS val 761499 ecr 761491], length 9448
17:22:30.188077 00:00:0a:00:00:01 > 00:00:0a:00:00:09, ethertype IPv4 (0x0800), length 66: 10.0.0.1.5201 > 10.0.0.9.37798: Flags [.], ack 340166, win 224, options [nop,nop,TS val 761552 ecr 761499], length 0
17:22:30.205781 00:00:0a:00:00:09 > 00:00:0a:00:00:01, ethertype IPv4 (0x0800), length 9514: 10.0.0.9.37798 > 10.0.0.1.5201: Flags [.], seq 340166:349614, ack 1, win 56, options [nop,nop,TS val 761518 ecr 761510], length 9448
17:22:30.251426 00:00:0a:00:00:01 > 00:00:0a:00:00:09, ethertype IPv4 (0x0800), length 66: 10.0.0.1.5201 > 10.0.0.9.37798: Flags [.], ack 349614, win 224, options [nop,nop,TS val 761568 ecr 761518], length 0
17:22:30.298807 00:00:0a:00:00:09 > 00:00:0a:00:00:01, ethertype IPv4 (0x0800), length 9514: 10.0.0.9.37798 > 10.0.0.1.5201: Flags [.], seq 349614:359062, ack 1, win 56, options [nop,nop,TS val 761537 ecr 761529], length 9448
17:22:30.354419 00:00:0a:00:00:01 > 00:00:0a:00:00:09, ethertype IPv4 (0x0800), length 66: 10.0.0.1.5201 > 10.0.0.9.37798: Flags [.], ack 359062, win 224, options [nop,nop,TS val 761594 ecr 761537], length 0
17:22:30.374183 00:00:0a:00:00:09 > 00:00:0a:00:00:01, ethertype IPv4 (0x0800), length 9514: 10.0.0.9.37798 > 10.0.0.1.5201: Flags [.], seq 359062:368510, ack 1, win 56, options [nop,nop,TS val 761556 ecr 761552], length 9448
17:22:30.422379 00:00:0a:00:00:01 > 00:00:0a:00:00:09, ethertype IPv4 (0x0800), length 66: 10.0.0.1.5201 > 10.0.0.9.37798: Flags [.], ack 368510, win 224, options [nop,nop,TS val 761609 ecr 761556], length 0
17:22:30.442136 00:00:0a:00:00:09 > 00:00:0a:00:00:01, ethertype IPv4 (0x0800), length 9514: 10.0.0.9.37798 > 10.0.0.1.5201: Flags [.], seq 368510:377958, ack 1, win 56, options [nop,nop,TS val 761576 ecr 761568], length 9448
17:22:30.603487 00:00:0a:00:00:09 > 00:00:0a:00:00:01, ethertype IPv4 (0x0800), length 9514: 10.0.0.9.37798 > 10.0.0.1.5201: Flags [P.], seq 377958:387406, ack 1, win 56, options [nop,nop,TS val 761594 ecr 761568], length 9448
17:22:30.604455 00:00:0a:00:00:01 > 00:00:0a:00:00:09, ethertype IPv4 (0x0800), length 66: 10.0.0.1.5201 > 10.0.0.9.37798: Flags [.], ack 377958, win 224, options [nop,nop,TS val 761630 ecr 761576], length 0
17:22:30.656121 00:00:0a:00:00:01 > 00:00:0a:00:00:09, ethertype IPv4 (0x0800), length 66: 10.0.0.1.5201 > 10.0.0.9.37798: Flags [.], ack 387406, win 224, options [nop,nop,TS val 761668 ecr 761594], length 0
17:22:30.673963 00:00:0a:00:00:09 > 00:00:0a:00:00:01, ethertype IPv4 (0x0800), length 9514: 10.0.0.9.37798 > 10.0.0.1.5201: Flags [.], seq 387406:396854, ack 1, win 56, options [nop,nop,TS val 761615 ecr 761609], length 9448
17:22:30.718797 00:00:0a:00:00:01 > 00:00:0a:00:00:09, ethertype IPv4 (0x0800), length 66: 10.0.0.1.5201 > 10.0.0.9.37798: Flags [.], ack 396854, win 224, options [nop,nop,TS val 761685 ecr 761615], length 0
17:22:30.745028 00:00:0a:00:00:09 > 00:00:0a:00:00:01, ethertype IPv4 (0x0800), length 9514: 10.0.0.9.37798 > 10.0.0.1.5201: Flags [.], seq 396854:406302, ack 1, win 56, options [nop,nop,TS val 761634 ecr 761609], length 9448
17:22:30.888981 00:00:0a:00:00:01 > 00:00:0a:00:00:09, ethertype IPv4 (0x0800), length 66: 10.0.0.1.5201 > 10.0.0.9.37798: Flags [.], ack 406302, win 224, options [nop,nop,TS val 761723 ecr 761634], length 0
17:22:31.010326 00:00:0a:00:00:09 > 00:00:0a:00:00:01, ethertype IPv4 (0x0800), length 9514: 10.0.0.9.37798 > 10.0.0.1.5201: Flags [.], seq 406302:415750, ack 1, win 56, options [nop,nop,TS val 761654 ecr 761609], length 9448
17:22:31.056575 00:00:0a:00:00:01 > 00:00:0a:00:00:09, ethertype IPv4 (0x0800), length 66: 10.0.0.1.5201 > 10.0.0.9.37798: Flags [.], ack 415750, win 224, options [nop,nop,TS val 761769 ecr 761654], length 0
17:22:31.086368 00:00:0a:00:00:09 > 00:00:0a:00:00:01, ethertype IPv4 (0x0800), length 9514: 10.0.0.9.37798 > 10.0.0.1.5201: Flags [.], seq 415750:425198, ack 1, win 56, options [nop,nop,TS val 761670 ecr 761630], length 9448
17:22:31.129997 00:00:0a:00:00:01 > 00:00:0a:00:00:09, ethertype IPv4 (0x0800), length 66: 10.0.0.1.5201 > 10.0.0.9.37798: Flags [.], ack 425198, win 224, options [nop,nop,TS val 761788 ecr 761670], length 0
17:22:31.151217 00:00:0a:00:00:09 > 00:00:0a:00:00:01, ethertype IPv4 (0x0800), length 9514: 10.0.0.9.37798 > 10.0.0.1.5201: Flags [.], seq 425198:434646, ack 1, win 56, options [nop,nop,TS val 761689 ecr 761685], length 9448
17:22:31.197354 00:00:0a:00:00:01 > 00:00:0a:00:00:09, ethertype IPv4 (0x0800), length 66: 10.0.0.1.5201 > 10.0.0.9.37798: Flags [.], ack 434646, win 224, options [nop,nop,TS val 761805 ecr 761689], length 0
17:22:31.230600 00:00:0a:00:00:09 > 00:00:0a:00:00:01, ethertype IPv4 (0x0800), length 9514: 10.0.0.9.37798 > 10.0.0.1.5201: Flags [.], seq 434646:444094, ack 1, win 56, options [nop,nop,TS val 761723 ecr 761685], length 9448
17:22:31.283935 00:00:0a:00:00:01 > 00:00:0a:00:00:09, ethertype IPv4 (0x0800), length 66: 10.0.0.1.5201 > 10.0.0.9.37798: Flags [.], ack 444094, win 224, options [nop,nop,TS val 761825 ecr 761723], length 0
17:22:31.302549 00:00:0a:00:00:09 > 00:00:0a:00:00:01, ethertype IPv4 (0x0800), length 9514: 10.0.0.9.37798 > 10.0.0.1.5201: Flags [P.], seq 444094:453542, ack 1, win 56, options [nop,nop,TS val 761755 ecr 761685], length 9448
17:22:31.354498 00:00:0a:00:00:01 > 00:00:0a:00:00:09, ethertype IPv4 (0x0800), length 66: 10.0.0.1.5201 > 10.0.0.9.37798: Flags [.], ack 453542, win 224, options [nop,nop,TS val 761844 ecr 761755], length 0
17:22:31.379381 00:00:0a:00:00:09 > 00:00:0a:00:00:01, ethertype IPv4 (0x0800), length 9514: 10.0.0.9.37798 > 10.0.0.1.5201: Flags [.], seq 453542:462990, ack 1, win 56, options [nop,nop,TS val 761766 ecr 761723], length 9448
17:22:31.429605 00:00:0a:00:00:01 > 00:00:0a:00:00:09, ethertype IPv4 (0x0800), length 66: 10.0.0.1.5201 > 10.0.0.9.37798: Flags [.], ack 462990, win 224, options [nop,nop,TS val 761863 ecr 761766], length 0
17:22:31.454867 00:00:0a:00:00:09 > 00:00:0a:00:00:01, ethertype IPv4 (0x0800), length 9514: 10.0.0.9.37798 > 10.0.0.1.5201: Flags [.], seq 462990:472438, ack 1, win 56, options [nop,nop,TS val 761784 ecr 761769], length 9448
17:22:31.511567 00:00:0a:00:00:01 > 00:00:0a:00:00:09, ethertype IPv4 (0x0800), length 66: 10.0.0.1.5201 > 10.0.0.9.37798: Flags [.], ack 472438, win 224, options [nop,nop,TS val 761883 ecr 761784], length 0
17:22:31.530395 00:00:0a:00:00:09 > 00:00:0a:00:00:01, ethertype IPv4 (0x0800), length 9514: 10.0.0.9.37798 > 10.0.0.1.5201: Flags [.], seq 472438:481886, ack 1, win 56, options [nop,nop,TS val 761803 ecr 761788], length 9448
17:22:31.555031 00:00:0a:00:00:01 > 00:00:0a:00:00:09, ethertype IPv4 (0x0800), length 66: 10.0.0.1.5201 > 10.0.0.9.37798: Flags [.], ack 481886, win 261, options [nop,nop,TS val 761893 ecr 761803], length 0
17:22:31.606902 00:00:0a:00:00:09 > 00:00:0a:00:00:01, ethertype IPv4 (0x0800), length 9514: 10.0.0.9.37798 > 10.0.0.1.5201: Flags [.], seq 481886:491334, ack 1, win 56, options [nop,nop,TS val 761822 ecr 761805], length 9448
17:22:31.618655 00:00:0a:00:00:01 > 00:00:0a:00:00:09, ethertype IPv4 (0x0800), length 66: 10.0.0.1.5201 > 10.0.0.9.37798: Flags [.], ack 491334, win 298, options [nop,nop,TS val 761910 ecr 761822], length 0
17:22:31.683225 00:00:0a:00:00:09 > 00:00:0a:00:00:01, ethertype IPv4 (0x0800), length 9514: 10.0.0.9.37798 > 10.0.0.1.5201: Flags [.], seq 491334:500782, ack 1, win 56, options [nop,nop,TS val 761841 ecr 761825], length 9448
17:22:31.698556 00:00:0a:00:00:01 > 00:00:0a:00:00:09, ethertype IPv4 (0x0800), length 66: 10.0.0.1.5201 > 10.0.0.9.37798: Flags [.], ack 500782, win 335, options [nop,nop,TS val 761929 ecr 761841], length 0
17:22:31.759198 00:00:0a:00:00:09 > 00:00:0a:00:00:01, ethertype IPv4 (0x0800), length 9514: 10.0.0.9.37798 > 10.0.0.1.5201: Flags [.], seq 500782:510230, ack 1, win 56, options [nop,nop,TS val 761860 ecr 761844], length 9448
17:22:31.771159 00:00:0a:00:00:01 > 00:00:0a:00:00:09, ethertype IPv4 (0x0800), length 66: 10.0.0.1.5201 > 10.0.0.9.37798: Flags [.], ack 510230, win 372, options [nop,nop,TS val 761948 ecr 761860], length 0
17:22:31.835011 00:00:0a:00:00:09 > 00:00:0a:00:00:01, ethertype IPv4 (0x0800), length 9514: 10.0.0.9.37798 > 10.0.0.1.5201: Flags [P.], seq 510230:519678, ack 1, win 56, options [nop,nop,TS val 761879 ecr 761863], length 9448
17:22:31.858523 00:00:0a:00:00:01 > 00:00:0a:00:00:09, ethertype IPv4 (0x0800), length 66: 10.0.0.1.5201 > 10.0.0.9.37798: Flags [.], ack 519678, win 409, options [nop,nop,TS val 761970 ecr 761879], length 0
17:22:31.911270 00:00:0a:00:00:09 > 00:00:0a:00:00:01, ethertype IPv4 (0x0800), length 9514: 10.0.0.9.37798 > 10.0.0.1.5201: Flags [.], seq 519678:529126, ack 1, win 56, options [nop,nop,TS val 761898 ecr 761893], length 9448
17:22:31.923804 00:00:0a:00:00:01 > 00:00:0a:00:00:09, ethertype IPv4 (0x0800), length 66: 10.0.0.1.5201 > 10.0.0.9.37798: Flags [.], ack 529126, win 446, options [nop,nop,TS val 761986 ecr 761898], length 0
17:22:31.987192 00:00:0a:00:00:09 > 00:00:0a:00:00:01, ethertype IPv4 (0x0800), length 9514: 10.0.0.9.37798 > 10.0.0.1.5201: Flags [.], seq 529126:538574, ack 1, win 56, options [nop,nop,TS val 761917 ecr 761910], length 9448
17:22:31.999683 00:00:0a:00:00:01 > 00:00:0a:00:00:09, ethertype IPv4 (0x0800), length 66: 10.0.0.1.5201 > 10.0.0.9.37798: Flags [.], ack 538574, win 483, options [nop,nop,TS val 762005 ecr 761917], length 0
17:22:32.063213 00:00:0a:00:00:09 > 00:00:0a:00:00:01, ethertype IPv4 (0x0800), length 9514: 10.0.0.9.37798 > 10.0.0.1.5201: Flags [.], seq 538574:548022, ack 1, win 56, options [nop,nop,TS val 761936 ecr 761929], length 9448
17:22:32.075072 00:00:0a:00:00:01 > 00:00:0a:00:00:09, ethertype IPv4 (0x0800), length 66: 10.0.0.1.5201 > 10.0.0.9.37798: Flags [.], ack 548022, win 520, options [nop,nop,TS val 762024 ecr 761936], length 0
17:22:32.139256 00:00:0a:00:00:09 > 00:00:0a:00:00:01, ethertype IPv4 (0x0800), length 9514: 10.0.0.9.37798 > 10.0.0.1.5201: Flags [.], seq 548022:557470, ack 1, win 56, options [nop,nop,TS val 761955 ecr 761948], length 9448
17:22:32.156384 00:00:0a:00:00:01 > 00:00:0a:00:00:09, ethertype IPv4 (0x0800), length 66: 10.0.0.1.5201 > 10.0.0.9.37798: Flags [.], ack 557470, win 557, options [nop,nop,TS val 762044 ecr 761955], length 0
17:22:32.215460 00:00:0a:00:00:09 > 00:00:0a:00:00:01, ethertype IPv4 (0x0800), length 9514: 10.0.0.9.37798 > 10.0.0.1.5201: Flags [.], seq 557470:566918, ack 1, win 56, options [nop,nop,TS val 761974 ecr 761970], length 9448
17:22:32.227629 00:00:0a:00:00:01 > 00:00:0a:00:00:09, ethertype IPv4 (0x0800), length 66: 10.0.0.1.5201 > 10.0.0.9.37798: Flags [.], ack 566918, win 593, options [nop,nop,TS val 762062 ecr 761974], length 0
17:22:32.295130 00:00:0a:00:00:09 > 00:00:0a:00:00:01, ethertype IPv4 (0x0800), length 9514: 10.0.0.9.37798 > 10.0.0.1.5201: Flags [.], seq 566918:576366, ack 1, win 56, options [nop,nop,TS val 761993 ecr 761986], length 9448
17:22:32.374041 00:00:0a:00:00:09 > 00:00:0a:00:00:01, ethertype IPv4 (0x0800), length 9514: 10.0.0.9.37798 > 10.0.0.1.5201: Flags [P.], seq 576366:585814, ack 1, win 56, options [nop,nop,TS val 762012 ecr 762005], length 9448
17:22:32.389365 00:00:0a:00:00:01 > 00:00:0a:00:00:09, ethertype IPv4 (0x0800), length 66: 10.0.0.1.5201 > 10.0.0.9.37798: Flags [.], ack 576366, win 630, options [nop,nop,TS val 762102 ecr 761993], length 0
17:22:32.444149 00:00:0a:00:00:09 > 00:00:0a:00:00:01, ethertype IPv4 (0x0800), length 9514: 10.0.0.9.37798 > 10.0.0.1.5201: Flags [.], seq 585814:595262, ack 1, win 56, options [nop,nop,TS val 762031 ecr 762024], length 9448
17:22:32.457322 00:00:0a:00:00:01 > 00:00:0a:00:00:09, ethertype IPv4 (0x0800), length 66: 10.0.0.1.5201 > 10.0.0.9.37798: Flags [.], ack 585814, win 667, options [nop,nop,TS val 762118 ecr 762012], length 0
17:22:32.523007 00:00:0a:00:00:09 > 00:00:0a:00:00:01, ethertype IPv4 (0x0800), length 9514: 10.0.0.9.37798 > 10.0.0.1.5201: Flags [.], seq 595262:604710, ack 1, win 56, options [nop,nop,TS val 762050 ecr 762044], length 9448
17:22:32.549291 00:00:0a:00:00:01 > 00:00:0a:00:00:09, ethertype IPv4 (0x0800), length 66: 10.0.0.1.5201 > 10.0.0.9.37798: Flags [.], ack 595262, win 704, options [nop,nop,TS val 762140 ecr 762031], length 0
17:22:32.601398 00:00:0a:00:00:09 > 00:00:0a:00:00:01, ethertype IPv4 (0x0800), length 9514: 10.0.0.9.37798 > 10.0.0.1.5201: Flags [.], seq 604710:614158, ack 1, win 56, options [nop,nop,TS val 762070 ecr 762062], length 9448
17:22:32.609699 00:00:0a:00:00:01 > 00:00:0a:00:00:09, ethertype IPv4 (0x0800), length 66: 10.0.0.1.5201 > 10.0.0.9.37798: Flags [.], ack 604710, win 741, options [nop,nop,TS val 762156 ecr 762050], length 0
17:22:32.672384 00:00:0a:00:00:09 > 00:00:0a:00:00:01, ethertype IPv4 (0x0800), length 9514: 10.0.0.9.37798 > 10.0.0.1.5201: Flags [.], seq 614158:623606, ack 1, win 56, options [nop,nop,TS val 762090 ecr 762062], length 9448
17:22:32.711031 00:00:0a:00:00:01 > 00:00:0a:00:00:09, ethertype IPv4 (0x0800), length 66: 10.0.0.1.5201 > 10.0.0.9.37798: Flags [.], ack 614158, win 778, options [nop,nop,TS val 762181 ecr 762070], length 0
17:22:32.748211 00:00:0a:00:00:09 > 00:00:0a:00:00:01, ethertype IPv4 (0x0800), length 9514: 10.0.0.9.37798 > 10.0.0.1.5201: Flags [.], seq 623606:633054, ack 1, win 56, options [nop,nop,TS val 762107 ecr 762102], length 9448
17:22:32.778285 00:00:0a:00:00:01 > 00:00:0a:00:00:09, ethertype IPv4 (0x0800), length 66: 10.0.0.1.5201 > 10.0.0.9.37798: Flags [.], ack 623606, win 815, options [nop,nop,TS val 762199 ecr 762090], length 0
17:22:32.824370 00:00:0a:00:00:09 > 00:00:0a:00:00:01, ethertype IPv4 (0x0800), length 9514: 10.0.0.9.37798 > 10.0.0.1.5201: Flags [.], seq 633054:642502, ack 1, win 56, options [nop,nop,TS val 762128 ecr 762118], length 9448
17:22:32.850095 00:00:0a:00:00:01 > 00:00:0a:00:00:09, ethertype IPv4 (0x0800), length 66: 10.0.0.1.5201 > 10.0.0.9.37798: Flags [.], ack 633054, win 852, options [nop,nop,TS val 762218 ecr 762107], length 0
17:22:32.900510 00:00:0a:00:00:09 > 00:00:0a:00:00:01, ethertype IPv4 (0x0800), length 9514: 10.0.0.9.37798 > 10.0.0.1.5201: Flags [P.], seq 642502:651950, ack 1, win 56, options [nop,nop,TS val 762160 ecr 762156], length 9448
17:22:32.926183 00:00:0a:00:00:01 > 00:00:0a:00:00:09, ethertype IPv4 (0x0800), length 66: 10.0.0.1.5201 > 10.0.0.9.37798: Flags [.], ack 642502, win 889, options [nop,nop,TS val 762237 ecr 762128], length 0
17:22:32.976494 00:00:0a:00:00:09 > 00:00:0a:00:00:01, ethertype IPv4 (0x0800), length 9514: 10.0.0.9.37798 > 10.0.0.1.5201: Flags [P.], seq 651950:661398, ack 1, win 56, options [nop,nop,TS val 762164 ecr 762156], length 9448
17:22:33.002299 00:00:0a:00:00:01 > 00:00:0a:00:00:09, ethertype IPv4 (0x0800), length 66: 10.0.0.1.5201 > 10.0.0.9.37798: Flags [.], ack 651950, win 926, options [nop,nop,TS val 762256 ecr 762160], length 0
17:22:33.053042 00:00:0a:00:00:09 > 00:00:0a:00:00:01, ethertype IPv4 (0x0800), length 9514: 10.0.0.9.37798 > 10.0.0.1.5201: Flags [.], seq 661398:670846, ack 1, win 56, options [nop,nop,TS val 762183 ecr 762156], length 9448
17:22:33.081961 00:00:0a:00:00:01 > 00:00:0a:00:00:09, ethertype IPv4 (0x0800), length 66: 10.0.0.1.5201 > 10.0.0.9.37798: Flags [.], ack 661398, win 962, options [nop,nop,TS val 762276 ecr 762164], length 0
17:22:33.157284 00:00:0a:00:00:09 > 00:00:0a:00:00:01, ethertype IPv4 (0x0800), length 9514: 10.0.0.9.37798 > 10.0.0.1.5201: Flags [.], seq 670846:680294, ack 1, win 56, options [nop,nop,TS val 762202 ecr 762199], length 9448
17:22:33.160217 00:00:0a:00:00:01 > 00:00:0a:00:00:09, ethertype IPv4 (0x0800), length 66: 10.0.0.1.5201 > 10.0.0.9.37798: Flags [.], ack 670846, win 999, options [nop,nop,TS val 762295 ecr 762183], length 0
17:22:33.220679 00:00:0a:00:00:09 > 00:00:0a:00:00:01, ethertype IPv4 (0x0800), length 9514: 10.0.0.9.37798 > 10.0.0.1.5201: Flags [.], seq 680294:689742, ack 1, win 56, options [nop,nop,TS val 762221 ecr 762218], length 9448
17:22:33.233599 00:00:0a:00:00:01 > 00:00:0a:00:00:09, ethertype IPv4 (0x0800), length 66: 10.0.0.1.5201 > 10.0.0.9.37798: Flags [.], ack 680294, win 1022, options [nop,nop,TS val 762313 ecr 762202], length 0
17:22:33.303447 00:00:0a:00:00:09 > 00:00:0a:00:00:01, ethertype IPv4 (0x0800), length 9514: 10.0.0.9.37798 > 10.0.0.1.5201: Flags [.], seq 689742:699190, ack 1, win 56, options [nop,nop,TS val 762240 ecr 762237], length 9448
17:22:33.354455 00:00:0a:00:00:01 > 00:00:0a:00:00:09, ethertype IPv4 (0x0800), length 66: 10.0.0.1.5201 > 10.0.0.9.37798: Flags [.], ack 689742, win 1022, options [nop,nop,TS val 762344 ecr 762221], length 0
17:22:33.372858 00:00:0a:00:00:09 > 00:00:0a:00:00:01, ethertype IPv4 (0x0800), length 9514: 10.0.0.9.37798 > 10.0.0.1.5201: Flags [.], seq 699190:708638, ack 1, win 56, options [nop,nop,TS val 762259 ecr 762256], length 9448
17:22:33.425190 00:00:0a:00:00:01 > 00:00:0a:00:00:09, ethertype IPv4 (0x0800), length 66: 10.0.0.1.5201 > 10.0.0.9.37798: Flags [.], ack 699190, win 1022, options [nop,nop,TS val 762361 ecr 762240], length 0
17:22:33.449402 00:00:0a:00:00:09 > 00:00:0a:00:00:01, ethertype IPv4 (0x0800), length 9514: 10.0.0.9.37798 > 10.0.0.1.5201: Flags [.], seq 708638:718086, ack 1, win 56, options [nop,nop,TS val 762278 ecr 762276], length 9448
17:22:33.498035 00:00:0a:00:00:01 > 00:00:0a:00:00:09, ethertype IPv4 (0x0800), length 66: 10.0.0.1.5201 > 10.0.0.9.37798: Flags [.], ack 708638, win 1022, options [nop,nop,TS val 762380 ecr 762259], length 0
17:22:33.525138 00:00:0a:00:00:09 > 00:00:0a:00:00:01, ethertype IPv4 (0x0800), length 9514: 10.0.0.9.37798 > 10.0.0.1.5201: Flags [.], seq 718086:727534, ack 1, win 56, options [nop,nop,TS val 762297 ecr 762295], length 9448
17:22:33.574258 00:00:0a:00:00:01 > 00:00:0a:00:00:09, ethertype IPv4 (0x0800), length 66: 10.0.0.1.5201 > 10.0.0.9.37798: Flags [.], ack 718086, win 1022, options [nop,nop,TS val 762399 ecr 762278], length 0
17:22:33.601204 00:00:0a:00:00:0a > 00:00:0a:00:00:02, ethertype IPv4 (0x0800), length 74: 10.0.0.10.45612 > 10.0.0.2.80: Flags [S], seq 2095135359, win 28380, options [mss 9460,sackOK,TS val 762336 ecr 0,nop,wscale 9], length 0
17:22:33.601960 00:00:0a:00:00:0a > 00:00:0a:00:00:02, ethertype IPv4 (0x0800), length 74: 10.0.0.10.45614 > 10.0.0.2.80: Flags [S], seq 247021865, win 28380, options [mss 9460,sackOK,TS val 762348 ecr 0,nop,wscale 9], length 0
17:22:33.602570 00:00:0a:00:00:09 > 00:00:0a:00:00:01, ethertype IPv4 (0x0800), length 9514: 10.0.0.9.37798 > 10.0.0.1.5201: Flags [P.], seq 727534:736982, ack 1, win 56, options [nop,nop,TS val 762316 ecr 762313], length 9448
17:22:33.652220 00:00:0a:00:00:01 > 00:00:0a:00:00:09, ethertype IPv4 (0x0800), length 66: 10.0.0.1.5201 > 10.0.0.9.37798: Flags [.], ack 727534, win 1022, options [nop,nop,TS val 762418 ecr 762297], length 0
17:22:33.678724 00:00:0a:00:00:09 > 00:00:0a:00:00:01, ethertype IPv4 (0x0800), length 9514: 10.0.0.9.37798 > 10.0.0.1.5201: Flags [.], seq 736982:746430, ack 1, win 56, options [nop,nop,TS val 762335 ecr 762313], length 9448
17:22:33.694839 00:00:0a:00:00:02 > 00:00:0a:00:00:0a, ethertype IPv4 (0x0800), length 74: 10.0.0.2.80 > 10.0.0.10.45612: Flags [S.], seq 3076962969, ack 2095135360, win 28344, options [mss 9460,sackOK,TS val 762426 ecr 762336,nop,wscale 9], length 0
17:22:33.698169 00:00:0a:00:00:02 > 00:00:0a:00:00:0a, ethertype IPv4 (0x0800), length 74: 10.0.0.2.80 > 10.0.0.10.45614: Flags [S.], seq 2733697463, ack 247021866, win 28344, options [mss 9460,sackOK,TS val 762426 ecr 762348,nop,wscale 9], length 0
17:22:33.734741 00:00:0a:00:00:01 > 00:00:0a:00:00:09, ethertype IPv4 (0x0800), length 66: 10.0.0.1.5201 > 10.0.0.9.37798: Flags [.], ack 736982, win 1022, options [nop,nop,TS val 762439 ecr 762316], length 0
17:22:33.754941 00:00:0a:00:00:09 > 00:00:0a:00:00:01, ethertype IPv4 (0x0800), length 9514: 10.0.0.9.37798 > 10.0.0.1.5201: Flags [.], seq 746430:755878, ack 1, win 56, options [nop,nop,TS val 762355 ecr 762344], length 9448
17:22:33.806628 00:00:0a:00:00:01 > 00:00:0a:00:00:09, ethertype IPv4 (0x0800), length 66: 10.0.0.1.5201 > 10.0.0.9.37798: Flags [.], ack 746430, win 1022, options [nop,nop,TS val 762457 ecr 762335], length 0
17:22:33.830757 00:00:0a:00:00:0a > 00:00:0a:00:00:02, ethertype IPv4 (0x0800), length 74: 10.0.0.10.45616 > 10.0.0.2.80: Flags [S], seq 3361394602, win 28380, options [mss 9460,sackOK,TS val 762399 ecr 0,nop,wscale 9], length 0
